{
  "schema_version": 1,
  "item": {
    "item_id": "comm_react_quality_pack",
    "kind": "pack",
    "name": "react-quality-pack",
    "display_name": "React Quality Pack",
    "description": "Sanitized community metadata for frontend review and QA workflows.",
    "version": "2026.06.08",
    "publisher": "community-maintainers",
    "visibility": "registered-community",
    "compatible_agents": ["codex", "claude-code"],
    "tags": ["frontend", "qa"],
    "skill_count": 6,
    "install_target": "community",
    "trust": {
      "reviewed": true,
      "review_status": "approved"
    }
  },
  "manifest_summary": {
    "format": "skill-collection-zip-v1",
    "files_bucket": "11-50",
    "skill_count": 6
  },
  "included_skill_names": ["react-review", "browser-qa"],
  "description": "Preview contains metadata and sanitized descriptions only.",
  "release_notes": "Initial reviewed community release.",
  "required_capabilities": ["filesystem", "browser"],
  "install_plan": {
    "collection": "community",
    "version": "2026.06.08",
    "skill_count": 6
  },
  "warnings": ["Review install plan before applying multi-skill packs."]
}
